{
  "protocolVersion": 2,
  "runtimeId": "runtime-01J00000000000000000000000",
  "desktopDeviceId": "desktop-device-001",
  "executionHost": "DESKTOP",
  "catalogVersion": "revit-mcp-local-v2",
  "catalogHash": "8fd7b6886896779e596d8e90fc844b9ac166c9d8a5e0b2d3ac1870523a4536a5",
  "maxFrameBytes": 8388608,
  "sidecarVersion": "2.0.0-alpha.1",
  "desktopVersion": "2.0.0-alpha.1",
  "startedAt": "2026-07-26T12:00:00.000Z",
  "capabilities": [
    "agent-runtime",
    "revit-mcp-152",
    "durable-events",
    "rich-plan-v1"
  ]
}
